{
  "id": "orc_chieftain",
  "name": "Orc Chieftain",
  "description": "A powerful orc leader",
  "hp": 150,
  "attack": 20,
  "defense": 10,
  "gold_reward": 100,
  "experience_reward": 50,
  "level": 5,
  "abilities": [
    {
      "id": "rage",
      "chance": 0.3,
      "cooldown": 2
    }
  ],
  "loot_table": [],
  "tags": ["orc", "boss"]
}

