{
  "id": "goblin_warrior",
  "name": "Goblin Warrior",
  "description": "A nasty little goblin armed with a rusty dagger",
  "hp": 50,
  "attack": 8,
  "defense": 2,
  "gold_reward": 25,
  "experience_reward": 15,
  "level": 1,
  "abilities": [
    {
      "id": "dodge",
      "chance": 0.2,
      "cooldown": 0
    }
  ],
  "loot_table": [
    {
      "item_id": "rusty_dagger",
      "chance": 0.3,
      "min_quantity": 1,
      "max_quantity": 1
    },
    {
      "item_id": "health_potion_small",
      "chance": 0.5,
      "min_quantity": 1,
      "max_quantity": 2
    }
  ],
  "tags": ["common", "goblin", "humanoid"]
}

